{
  "$schema": "../schemas/instruction-mapping.schema.json",
  "isa": "RV32I",
  "version": "1.0.0",
  "spec_reference": "https://github.com/riscv/riscv-isa-manual/releases/download/riscv-isa-release-98ea4b5-2025-11-05/riscv-unprivileged.html",
  "instructions": {
    "LUI": {
      "format": "U-type",
      "encoding": {
        "opcode": "0b0110111",
        "rd": "bits 11:7",
        "imm": "bits 31:12 (upper 20 bits)",
        "full_encoding": "imm[31:12] | rd[11:7] | 0110111"
      },
      "assembly_syntax": "rd, imm",
      "description": "Load Upper Immediate - places the 20-bit immediate into bits 31:12 of rd, zeroing bits 11:0",
      "comment": "LUI (load upper immediate) is used to build 32-bit constants and uses the U-type format. LUI places the 20-bit U-immediate into bits 31â€“12 of register rd and places zero in the lowest 12 bits.",
      "spec_section": "2.4.1",
      "operation": "rd = imm << 12"
    },
    "AUIPC": {
      "format": "U-type",
      "encoding": {
        "opcode": "0b0010111",
        "rd": "bits 11:7",
        "imm": "bits 31:12 (upper 20 bits)",
        "full_encoding": "imm[31:12] | rd[11:7] | 0010111"
      },
      "assembly_syntax": "rd, imm",
      "description": "Add Upper Immediate to PC - forms a 32-bit offset and adds it to the PC",
      "comment": "AUIPC (add upper immediate to pc) is used to build pc-relative addresses and uses the U-type format. AUIPC forms a 32-bit offset from the 20-bit U-immediate, filling in the lowest 12 bits with zeros, adds this offset to the address of the AUIPC instruction, then places the result in register rd.",
      "spec_section": "2.4.1",
      "operation": "rd = pc + (imm << 12)"
    },
    "JAL": {
      "format": "J-type",
      "encoding": {
        "opcode": "0b1101111",
        "rd": "bits 11:7",
        "imm": "bits 31:12 encoded as imm[20|10:1|11|19:12]",
        "full_encoding": "imm[20|10:1|11|19:12] | rd[11:7] | 1101111"
      },
      "assembly_syntax": "rd, offset",
      "description": "Jump and Link - jumps to PC+offset and stores return address in rd",
      "comment": "The jump and link (JAL) instruction uses the J-type format, where the J-immediate encodes a signed offset in multiples of 2 bytes. The offset is sign-extended and added to the address of the jump instruction to form the jump target address. JAL stores the address of the instruction following the jump (pc+4) into register rd.",
      "spec_section": "2.5.1",
      "operation": "rd = pc + 4; pc = pc + sext(imm)"
    },
    "JALR": {
      "format": "I-type",
      "encoding": {
        "opcode": "0b1100111",
        "funct3": "0b000",
        "rd": "bits 11:7",
        "rs1": "bits 19:15",
        "imm": "bits 31:20 (12-bit signed)",
        "full_encoding": "imm[11:0] | rs1[19:15] | 000 | rd[11:7] | 1100111"
      },
      "assembly_syntax": "rd, rs1, offset",
      "description": "Jump and Link Register - jumps to rs1+offset and stores return address in rd",
      "comment": "The indirect jump instruction JALR (jump and link register) uses the I-type encoding. The target address is obtained by adding the sign-extended 12-bit I-immediate to the register rs1, then setting the least-significant bit of the result to zero. The address of the instruction following the jump (pc+4) is written to register rd.",
      "spec_section": "2.5.1",
      "operation": "rd = pc + 4; pc = (rs1 + sext(imm)) & ~1"
    },
    "BEQ": {
      "format": "B-type",
      "encoding": {
        "opcode": "0b1100011",
        "funct3": "0b000",
        "rs1": "bits 19:15",
        "rs2": "bits 24:20",
        "imm": "bits 31:25,11:7 encoded as imm[12|10:5|4:1|11]",
        "full_encoding": "imm[12|10:5] | rs2[24:20] | rs1[19:15] | 000 | imm[4:1|11] | 1100011"
      },
      "assembly_syntax": "rs1, rs2, offset",
      "description": "Branch if Equal - branches to PC+offset if rs1 equals rs2",
      "comment": "BEQ and BNE take the branch if registers rs1 and rs2 are equal or unequal respectively.",
      "spec_section": "2.5.2",
      "operation": "if (rs1 == rs2) pc = pc + sext(imm)"
    },
    "BNE": {
      "format": "B-type",
      "encoding": {
        "opcode": "0b1100011",
        "funct3": "0b001",
        "rs1": "bits 19:15",
        "rs2": "bits 24:20",
        "imm": "bits 31:25,11:7 encoded as imm[12|10:5|4:1|11]",
        "full_encoding": "imm[12|10:5] | rs2[24:20] | rs1[19:15] | 001 | imm[4:1|11] | 1100011"
      },
      "assembly_syntax": "rs1, rs2, offset",
      "description": "Branch if Not Equal - branches to PC+offset if rs1 does not equal rs2",
      "comment": "BEQ and BNE take the branch if registers rs1 and rs2 are equal or unequal respectively.",
      "spec_section": "2.5.2",
      "operation": "if (rs1 != rs2) pc = pc + sext(imm)"
    },
    "BLT": {
      "format": "B-type",
      "encoding": {
        "opcode": "0b1100011",
        "funct3": "0b100",
        "rs1": "bits 19:15",
        "rs2": "bits 24:20",
        "imm": "bits 31:25,11:7 encoded as imm[12|10:5|4:1|11]",
        "full_encoding": "imm[12|10:5] | rs2[24:20] | rs1[19:15] | 100 | imm[4:1|11] | 1100011"
      },
      "assembly_syntax": "rs1, rs2, offset",
      "description": "Branch if Less Than - branches if rs1 is less than rs2 (signed comparison)",
      "comment": "BLT and BLTU take the branch if rs1 is less than rs2, using signed and unsigned comparison respectively.",
      "spec_section": "2.5.2",
      "operation": "if (signed(rs1) < signed(rs2)) pc = pc + sext(imm)"
    },
    "BGE": {
      "format": "B-type",
      "encoding": {
        "opcode": "0b1100011",
        "funct3": "0b101",
        "rs1": "bits 19:15",
        "rs2": "bits 24:20",
        "imm": "bits 31:25,11:7 encoded as imm[12|10:5|4:1|11]",
        "full_encoding": "imm[12|10:5] | rs2[24:20] | rs1[19:15] | 101 | imm[4:1|11] | 1100011"
      },
      "assembly_syntax": "rs1, rs2, offset",
      "description": "Branch if Greater or Equal - branches if rs1 >= rs2 (signed comparison)",
      "comment": "BGE and BGEU take the branch if rs1 is greater than or equal to rs2, using signed and unsigned comparison respectively.",
      "spec_section": "2.5.2",
      "operation": "if (signed(rs1) >= signed(rs2)) pc = pc + sext(imm)"
    },
    "BLTU": {
      "format": "B-type",
      "encoding": {
        "opcode": "0b1100011",
        "funct3": "0b110",
        "rs1": "bits 19:15",
        "rs2": "bits 24:20",
        "imm": "bits 31:25,11:7 encoded as imm[12|10:5|4:1|11]",
        "full_encoding": "imm[12|10:5] | rs2[24:20] | rs1[19:15] | 110 | imm[4:1|11] | 1100011"
      },
      "assembly_syntax": "rs1, rs2, offset",
      "description": "Branch if Less Than Unsigned - branches if rs1 < rs2 (unsigned comparison)",
      "comment": "BLT and BLTU take the branch if rs1 is less than rs2, using signed and unsigned comparison respectively.",
      "spec_section": "2.5.2",
      "operation": "if (unsigned(rs1) < unsigned(rs2)) pc = pc + sext(imm)"
    },
    "BGEU": {
      "format": "B-type",
      "encoding": {
        "opcode": "0b1100011",
        "funct3": "0b111",
        "rs1": "bits 19:15",
        "rs2": "bits 24:20",
        "imm": "bits 31:25,11:7 encoded as imm[12|10:5|4:1|11]",
        "full_encoding": "imm[12|10:5] | rs2[24:20] | rs1[19:15] | 111 | imm[4:1|11] | 1100011"
      },
      "assembly_syntax": "rs1, rs2, offset",
      "description": "Branch if Greater or Equal Unsigned - branches if rs1 >= rs2 (unsigned comparison)",
      "comment": "BGE and BGEU take the branch if rs1 is greater than or equal to rs2, using signed and unsigned comparison respectively.",
      "spec_section": "2.5.2",
      "operation": "if (unsigned(rs1) >= unsigned(rs2)) pc = pc + sext(imm)"
    },
    "LB": {
      "format": "I-type",
      "encoding": {
        "opcode": "0b0000011",
        "funct3": "0b000",
        "rd": "bits 11:7",
        "rs1": "bits 19:15",
        "imm": "bits 31:20 (12-bit signed offset)",
        "full_encoding": "imm[11:0] | rs1[19:15] | 000 | rd[11:7] | 0000011"
      },
      "assembly_syntax": "rd, offset(rs1)",
      "description": "Load Byte - loads an 8-bit value from memory, sign-extends to XLEN",
      "comment": "The LB and LBU instructions load an 8-bit value from memory. LB then sign-extends to XLEN bits before storing in rd.",
      "spec_section": "2.6",
      "operation": "rd = sext(mem[rs1 + sext(imm)][7:0])"
    },
    "LH": {
      "format": "I-type",
      "encoding": {
        "opcode": "0b0000011",
        "funct3": "0b001",
        "rd": "bits 11:7",
        "rs1": "bits 19:15",
        "imm": "bits 31:20 (12-bit signed offset)",
        "full_encoding": "imm[11:0] | rs1[19:15] | 001 | rd[11:7] | 0000011"
      },
      "assembly_syntax": "rd, offset(rs1)",
      "description": "Load Halfword - loads a 16-bit value from memory, sign-extends to XLEN",
      "comment": "The LH and LHU instructions load a 16-bit value from memory. LH then sign-extends to XLEN bits before storing in rd.",
      "spec_section": "2.6",
      "operation": "rd = sext(mem[rs1 + sext(imm)][15:0])"
    },
    "LW": {
      "format": "I-type",
      "encoding": {
        "opcode": "0b0000011",
        "funct3": "0b010",
        "rd": "bits 11:7",
        "rs1": "bits 19:15",
        "imm": "bits 31:20 (12-bit signed offset)",
        "full_encoding": "imm[11:0] | rs1[19:15] | 010 | rd[11:7] | 0000011"
      },
      "assembly_syntax": "rd, offset(rs1)",
      "description": "Load Word - loads a 32-bit value from memory",
      "comment": "The LW instruction loads a 32-bit value from memory into rd. For RV64I, the 32-bit value is sign-extended to 64 bits before being stored in rd.",
      "spec_section": "2.6",
      "operation": "rd = sext(mem[rs1 + sext(imm)][31:0])"
    },
    "LBU": {
      "format": "I-type",
      "encoding": {
        "opcode": "0b0000011",
        "funct3": "0b100",
        "rd": "bits 11:7",
        "rs1": "bits 19:15",
        "imm": "bits 31:20 (12-bit signed offset)",